{
    "cfme_version_mappings": {
        "0.0": "0.0"
    },
    "env_to_releasever_mappings": {
        "prod": {
            "current_rhel0_beta": "0.0",
            "current_rhel0_dist": "0.0",
            "latest_rhel0_beta": "0.0",
            "latest_rhel0_dist": "0.0"
        },
        "qa": {
            "current_rhel0_beta": "0.0",
            "current_rhel0_dist": "0.0",
            "latest_rhel0_beta": "0.0",
            "latest_rhel0_dist": "0.0"
        },
        "stage": {
            "current_rhel0_beta": "0.0",
            "current_rhel0_dist": "0.0",
            "latest_rhel0_beta": "0.0",
            "latest_rhel0_dist": null
        }
    },
    "exclude_from_listings": [
        "0.0"
    ],
    "filter_arches_from_release": {
        "0": [
            "example_64"
        ]
    },
    "ignore_lp_version_product_ids": [
        "000"
    ],
    "origin_alias": [
        {
            "dest": "/origin",
            "src": "/content/origin"
        },
        {
            "dest": "/origin/rpms",
            "src": "/origin/rpm"
        }
    ],
    "override_initial_rhel_release": {
        "0": "0.0"
    },
    "populate_ubi_dot_repos": true,
    "release_stream_mappings": {
        "aus": [
            "0.0"
        ],
        "e4s": [
            "0.0"
        ],
        "eus": [
            "0.0"
        ],
        "other": [
            "0.0"
        ],
        "tus": [
            "0.0"
        ]
    },
    "rhel_open_dist": [
        0
    ],
    "rhui_alias": [
        {
            "dest": "/content/aus/rhel8",
            "src": "/content/aus/rhel8/rhui"
        },
        {
            "dest": "/content/aus/rhel",
            "src": "/content/aus/rhel/rhui"
        },
        {
            "dest": "/content/beta/rhel8",
            "src": "/content/beta/rhel8/rhui"
        },
        {
            "dest": "/content/beta/rhel-alt",
            "src": "/content/beta/rhel-alt/rhui"
        },
        {
            "dest": "/content/beta/rhel",
            "src": "/content/beta/rhel/rhui"
        },
        {
            "dest": "/content/beta/rhs",
            "src": "/content/beta/rhs/rhui"
        },
        {
            "dest": "/content/dist/layered",
            "src": "/content/dist/layered/rhui"
        },
        {
            "dest": "/content/dist/middleware",
            "src": "/content/dist/middleware/rhui"
        },
        {
            "dest": "/content/dist/rhel8",
            "src": "/content/dist/rhel8/rhui"
        },
        {
            "dest": "/content/dist/rhel-alt",
            "src": "/content/dist/rhel-alt/rhui"
        },
        {
            "dest": "/content/dist/rhel",
            "src": "/content/dist/rhel/rhui"
        },
        {
            "dest": "/content/dist/rhes",
            "src": "/content/dist/rhes/rhui"
        },
        {
            "dest": "/content/dist/rhs",
            "src": "/content/dist/rhs/rhui"
        },
        {
            "dest": "/content/e4s/rhel8",
            "src": "/content/e4s/rhel8/rhui"
        },
        {
            "dest": "/content/e4s/rhel",
            "src": "/content/e4s/rhel/rhui"
        },
        {
            "dest": "/content/els/rhel",
            "src": "/content/els/rhel/rhui"
        },
        {
            "dest": "/content/eus/rhel8",
            "src": "/content/eus/rhel8/rhui"
        },
        {
            "dest": "/content/eus/rhel",
            "src": "/content/eus/rhel/rhui"
        },
        {
            "dest": "/content/rc/rhel",
            "src": "/content/rc/rhel/rhui"
        }
    ],
    "rhui_product_id": "000",
    "signing_keys_mappings": {
        "default": {
            "beta_keys": [
                "BBBBBBBB"
            ],
            "ga_keys": [
                "00000000"
            ]
        },
        "layered_product": {
            "example-lp": {
                "ga_keys": [
                    "00000000"
                ]
            }
        },
        "major_version": {
            "0": {
                "beta_keys": [
                    "BBBBBBBB"
                ],
                "ga_keys": [
                    "00000000"
                ]
            }
        },
        "platform": {
            "example_none": {
                "ga_keys": []
            },
            "example_platform": {
                "beta_keys": [
                    "BBBBBBBB"
                ],
                "ga_keys": [
                    "FFFFFFFF"
                ]
            }
        }
    },
    "symlink_exceptions": [
        "/this/is/an/example/"
    ],
    "tps_variant_mappings": {
        "example-arch": "Example-Variant"
    },
    "version": "1.2.0"
}